{
  "schema_version": 1,
  "mrn": "MRN0001234",
  "encounter_id": "ENC000001",
  "icu_hour": 5,
  "hour_ending": "2024-03-15T13:30:00+00:00",
  "scored_at": "2024-03-15T13:00:06.200000Z",
  "news2": {
    "total": 10,
    "components": {
      "respiratory_rate": 2,
      "spo2": 2,
      "supplemental_o2": 2,
      "systolic_bp": 2,
      "pulse": 1,
      "consciousness": 0,
      "temperature": 1
    },
    "single_parameter_three": false
  },
  "raw_score": 1.42,
  "calibrated_probability": 0.31,
  "model_version": "xgb-20240301-abc1234",
  "alerted": true
}
